PR_164,1,"Just the cliche of pink being fluffy, delicate ""girly""",,,,,1,,,,,,,,4,,,,PR_164,1,"Just the cliche of pink being fluffy, delicate ""girly""",,,,,1,,,,,,
PR_165,1,Just a gut feeling,,,,,,,,,1,,,,4,,,,PR_165,1,Just a gut feeling,,,,,,,,1,,,
PR_166,1,"The colour pink always seems, to me, to be associated with a less intense feeling or vatmosphere",,1,1,,,,,,,,,,4,,,,PR_166,1,"The colour pink always seems, to me, to be associated with a less intense feeling or vatmosphere",,1,1,,,,,,,,
PR_167,1,"Traditionally pink = girls, blue = boys.",,,,,1,,,,,,,,4,,,,PR_167,1,"Traditionally pink = girls, blue = boys.",,,,,1,,,,,,
PR_168,1,Feeling t,,,1,,,,,,1,,,,4,,,,PR_168,1,Feeling t,,,1,,,,,1,,,
PR_169,1,Feel like I may have seen somebody actually have a pink party,1,,,1,,,,,,,,,4,,,,PR_169,1,Feel like I may have seen somebody actually have a pink party,1,,,1,,,,,,,
PR_170,1,Everyday knowledge,,,,,1,,,1,,,,,4,,,,PR_170,1,Everyday knowledge,,,,,1,,,1,,,
PR_171,1,Gut instinct,,,,,,,,,1,,,,4,,,,PR_171,1,Gut instinct,,,,,,,,1,,,
PR_172,1,Pink is usually associated with girls for my generation.,,1,,,1,,,,,,,,4,,,,PR_172,1,Pink is usually associated with girls for my generation.,,1,,,1,,,,,,
PR_173,1,Guesswork,,,,,,,,,,,1,,4,,,,PR_173,1,Guesswork,,,,,,,,,,1,
PR_174,1,NA,,,,,,,,,,,,1,4,,,,PR_174,1,NA,,,,,,,,,,,1
PR_175,1,I must admit I went with gender stereotype,,,,,1,,,,,,,,4,,,,PR_175,1,I must admit I went with gender stereotype,,,,,1,,,,,,
PR_176,1,Based on the perception of pink and pink being associated with hen parties,1,1,,,1,,,,,,,,4,,,,PR_176,1,Based on the perception of pink and pink being associated with hen parties,1,1,,,1,,,,,,
PR_177,1,I thought about what I think pink things mean.,1,1,,,,,,,,,,,4,,,,PR_177,1,I thought about what I think pink things mean.,1,1,,,,,,,,,
PR_178,1,Pink is often sued to identify a girl.,,,,,1,,,,,,,,4,,,,PR_178,1,Pink is often sued to identify a girl.,,,,,1,,,,,,
PR_179,1,what's pink associated with,,1,,,,,,,,,,,4,,,,PR_179,1,what's pink associated with,,1,,,,,,,,,
PR_180,1,Association with the colour,,1,,,,,,,,,,,4,,,,PR_180,1,Association with the colour,,1,,,,,,,,,
PR_181,1,From my own opinion,,,,,,,,1,,,,,4,,,,PR_181,1,From my own opinion,,,,,,,,1,,,
PR_182,1,Pink is normally associated with girls.,,1,,,1,,,,,,,,4,,,,PR_182,1,Pink is normally associated with girls.,,1,,,1,,,,,,
PR_183,1,"I imagined being at the party and what the ""pink"" meant",1,,,,,1,,,,,,,4,,,,PR_183,1,"I imagined being at the party and what the ""pink"" meant",1,,,,,1,,,,,
PR_184,1,from previous parties I have frequented,,,,1,,,,,,,,,4,,,,PR_184,1,from previous parties I have frequented,,,,1,,,,,,,
PR_185,1,It‚Äôs the first thing that I thought of,,,,,,,,1,,,,,4,,,,PR_185,1,It‚Äôs the first thing that I thought of,,,,,,,,1,,,
PR_186,1,My 6yo daughter likes a lot of pink,1,,,1,,,,,,,,,4,,,,PR_186,1,My 6yo daughter likes a lot of pink,1,,,1,,,,,,,
PR_187,1,pink is normally associated with girls,,1,,,1,,,,,,,,4,,,,PR_187,1,pink is normally associated with girls,,1,,,1,,,,,,
PR_188,1,Pink is considered to be making things very feminine,,1,,,1,,,,,,,,4,,,,PR_188,1,Pink is considered to be making things very feminine,,1,,,1,,,,,,
PR_189,1,Wasn‚Äôt sure,,,,,,,,,,,1,,4,,,,PR_189,1,Wasn‚Äôt sure,,,,,,,,,,1,
PR_190,1,pink makes me feel excited,,,1,,,,,,,,,,4,,,,PR_190,1,pink makes me feel excited,,,1,,,,,,,,
PR_191,1,Don't understand the question,,,,,,,,,,1,,,4,,,,PR_191,1,Don't understand the question,,,,,,,,,1,,
PR_192,1,Pink is assosiated with feemales,,1,,,1,,,,,,,,4,,,,PR_192,1,Pink is assosiated with feemales,,1,,,1,,,,,,
PR_193,1,from life experiences,,,,1,,,,,,,,,4,,,,PR_193,1,from life experiences,,,,1,,,,,,,
PR_194,1,Pink is associated with girls,,1,,,1,,,,,,,,4,,,,PR_194,1,Pink is associated with girls,,1,,,1,,,,,,
PR_195,1,Guess,,,,,,,,,,,1,,4,,,,PR_195,1,Guess,,,,,,,,,,1,
PR_196,1,I just think of pink as being girly and cute,,1,,,1,,,,,,,,4,,,,PR_196,1,I just think of pink as being girly and cute,,1,,,1,,,,,,
PR_197,1,"A party is usually happy, so went with a theme",,,1,,,,,,,,,,4,,,,PR_197,1,"A party is usually happy, so went with a theme",,,1,,,,,,,,
PR_198,1,tried to picture the party in my mind,1,,,,,,,,,,,,4,,,,PR_198,1,tried to picture the party in my mind,1,,,,,,,,,,
PR_199,1,i associated it with my previous answers,,,,,,,1,,,,,,4,,,,PR_199,1,i associated it with my previous answers,,,,,,,1,,,,
PR_200,1,Thinking of the colour and what is assicoated with that colour,1,1,,,,,,,,,,,4,,,,PR_200,1,Thinking of the colour and what is assicoated with that colour,1,1,,,,,,,,,
PR_201,1,used my perception of colour,1,,,,,,,,,,,,4,,,,PR_201,1,used my perception of colour,1,,,,,,,,,,
PR_202,1,guess,,,,,,,,,,,1,,4,,,,PR_202,1,guess,,,,,,,,,,1,
PR_203,1,Based on the colour of the party it would be associated as feminine,,1,,,1,,,,,,,,4,,,,PR_203,1,Based on the colour of the party it would be associated as feminine,,1,,,1,,,,,,
PR_204,0,past traditional sayng,,,,,,,1,,,,,,3,,,,,,,,,,,,,,,,,
PR_205,0,NA,,,,,,,,,,,,1,3,,,,,,,,,,,,,,,,,
PR_206,0,Read the sentence a few times and tried to picture it,1,,,,,1,,,,,,,3,,,,,,,,,,,,,,,,,
PR_207,0,I thought of what the colour pink represents to me,,1,,,,,,,,,,,3,,,,,,,,,,,,,,,,,
PR_208,1,It felt right to me.,,,,,,,,1,1,,,,4,,,,PR_208,1,It felt right to me.,,,,,,,,1,,,
PR_209,0,"I thought of ways it was pink, literally or to represent a feeling",1,,1,,,,,,,,,,3,,,,,,,,,,,,,,,,,
PR_210,0,Thought about what Pink usually means.,,,,,,1,,,,,,,3,,,,,,,,,,,,,,,,,
PR_211,0,My perception of this colour.,1,,,,,,,,,,,,3,,,,,,,,,,,,,,,,,
PR_212,0,Not sure,,,,,,,,,,,1,,3,,,,,,,,,,,,,,,,,
PR_213,0,Girls like pink,,,,,1,,,,,,,,3,,,,,,,,,,,,,,,,,
PR_214,1,Imagining a pink party,1,,,,,,,,,,,,4,,,,PR_214,1,Imagining a pink party,1,,,,,,,,,,
PR_215,0,i guessed,,,,,,,,,,,1,,3,,,,,,,,,,,,,,,,,
PR_216,1,Pink feel like a light item of clothing. Therefore casual attire.,1,,,,,,,,,,,,4,,,,PR_216,1,Pink feel like a light item of clothing. Therefore casual attire.,1,,,,,,,,,,
PR_217,1,It was the first thing that came to mind that made me laugh,,,,,,,,,1,,,,4,,,,PR_217,1,It was the first thing that came to mind that made me laugh,,,,,,,,1,,,
PR_218,0,By what Ivfee the colour pink means,,,,,,1,,,,,,,3,,,,,,,,,,,,,,,,,
PR_219,1,Used my biases about gender roles and colours,,,,,1,,,,,,,,4,,,,PR_219,1,Used my biases about gender roles and colours,,,,,1,,,,,,
PR_220,0,I guessed what the answer could be.,,,,,,,,,,,1,,3,,,,,,,,,,,,,,,,,
PR_221,0,just a feeling,,,,,,,,,1,,,,3,,,,,,,,,,,,,,,,,
PR_222,0,Based on my previous answers and what i thought the colour meant,,,,,,1,1,,,,,,3,,,,,,,,,,,,,,,,,
PR_223,0,Pink is the colour associated with the gay community,,1,,,1,,,,,,,,3,,,,,,,,,,,,,,,,,
PR_224,1,no,,,,,,,,,,,,1,4,,,,PR_224,1,no,,,,,,,,,,,1
PR_225,1,I just tried to think of what I would associate the word pink a party being held and what emotions I might associate pink with,,1,1,,,1,,,,,,,4,,,,PR_225,1,I just tried to think of what I would associate the word pink a party being held and what emotions I might associate pink with,,1,1,,,1,,,,,
PR_226,1,pink = girl,,,,,1,,,,,,,,4,,,,PR_226,1,pink = girl,,,,,1,,,,,,
PR_227,1,I used a play on words to describe the party,,,,,,1,,,,,,,4,,,,PR_227,1,I used a play on words to describe the party,,,,,,1,,,,,
CH_01,0,"As an AI language model, I do not have personal beliefs or emotions, but metaphorically, the sentence \""It was a very pink party\"" could mean that the party was very lively, vibrant, and full of energy. Alternatively, it could also mean that the party was overly feminine or girly in nature, depending on the context in which it is used."", ""85."", ""As an AI language model, I informed my answer by analyzing the phrase \""very pink party\"" with my language algorithms and using my knowledge of common metaphors and figures of speech. Based on this analysis, I provided possible interpretations of what the sentence could mean metaphorically. However, since the interpretation of metaphors can be subjective and context-dependent, my confidence level is not 100%.""",,,,,,1,,,,,,,2,,,,,,,,,,,,,,,,,
CH_02,0,"As an AI language model, I cannot gauge emotions, but metaphorically, the sentence \""It was a very pink party\"" can suggest that the party was excessively or exaggeratedly feminine or girly in its atmosphere, decorations, or activities."", ""90"", ""I based my answer on the common use of the color pink as a symbol of femininity and girliness in contemporary culture. The use of the word \""very\"" also suggests that the party was particularly intense in its level of pinkness, implying a metaphorical meaning of excess or exaggeration in the feminine elements of the gathering.""",1,1,,,1,,,,,,,,2,,,,,,,,,,,,,,,,,
CH_03,0,"As an AI language model, I cannot infer the context and interpret the meaning metaphorically without additional information as it can differ in different contexts and situations. Please provide more information so that I can assist you better."", ""0"", ""As an AI language model, I couldn't infer the context of the sentence, so I couldn't provide a metaphorical meaning without additional information. Without sufficient context and information, I cannot form a proper answer. My previous answer was simply acknowledging this lack of information.",,,,,,,,,,,,1,2,,,,,,,,,,,,,,,,,
CH_04,0,"As an AI language model, I cannot provide personal opinions or beliefs, but metaphorically, the sentence could suggest that the party was very feminine, whimsical, delicate, or excessively decorated with the color pink."", ""90."", ""As an AI language model, I use natural language processing algorithms to analyze the language used in the sentence and determine the possible meanings based on common associations and contextual clues. The sentence suggests a metaphorical meaning of the phrase, which I further interpreted in my response by analyzing the semantic associations of the adjective \""pink\",,,,,,1,,,,,,,2,,,,,,,,,,,,,,,,,
CH_05,0,"As an AI language model, I do not have personal beliefs and emotions, but metaphorically, the sentence \""It was a very pink party\"" could mean that the party was overly feminine or girly in nature. It could also mean that the party was very upbeat and cheerful."", ""80"", ""I based my answer on common cultural associations with the color pink, as well as understanding of the sentence structure and the use of vivid language to describe the party. The phrase \""very pink\"" suggests an abundance of pink decorations, perhaps even to the point of overwhelming the senses, which could metaphorically relate to the gendered associations of pink or the excitement level at the party.",1,1,,,1,,,,,,,,2,,,,,,,,,,,,,,,,,
CH_06,0,"As an AI language model, I do not have personal beliefs and emotions, but metaphorically, \""It was a very pink party\"" could mean that the party was excessively or blatantly feminine, luxurious, or celebratory in nature. The color pink is often associated with femininity and extravagance, so the sentence could be conveying a sense of flamboyance or indulgence",,1,,,1,,,,,,,,2,,,,,,,,,,,,,,,,,
CH_07,0,"As an AI language model, I analyzed the sentence and used my programmed knowledge of language and cultural associations to make an interpretation of the phrase \""It was a very pink party.\"" Pink is often associated with femininity and luxury, and it is also a vibrant color that tends to attract attention. Therefore, based on this analysis, I suggested the metaphorical interpretation that the party was excessively or blatantly feminine, luxurious, or celebratory. While my response is based on common associations, it may not be a perfect interpretation as context can play a big role in the meaning of language.",,1,,,1,,,,,,,,2,,,,,,,,,,,,,,,,,
CH_08,0,"As an AI language model, I cannot interpret metaphors or meaning beyond the surface level, but to the best of my knowledge, the sentence \""It was a very pink party\"" could suggest that the party was especially girly or feminine, or that it had a lot of decorations, clothing or atmosphere that were pink."", ""85."", ""I informed my answer based on my understanding of the literal meaning of the words \""pink\"" and \""party\"" and the common connotations that people associate with them. Additionally, I drew upon my training data and my language processing algorithms that analyze language usage patterns to provide the most likely interpretations of the sentence. Although I cannot fully understand metaphors or nuances in language like a human can, using sophisticated algorithms, training data and contextual information provides me with the ability to provide a probabilistic answer that is mostly accurate.",,,,,,1,,,,,,,2,,,,,,,,,,,,,,,,,
CH_09,0,"As an AI language model, I don't have personal opinions or thoughts. However, metaphorically, \""It was a very pink party\"" may mean that the party was overly feminine, flamboyant, or excessively focused on appearances rather than substance."", ""80"", ""As an AI language model, my response was informed by the interpretation of the word \""pink\"" in the context of the sentence. Pink is typically associated with feminine and delicate qualities, and when used to describe a party, it may connote a similar atmosphere. Additionally, the use of the word \""very\"" before \""pink\"" suggests an emphasis on the color, which could imply an excessive emphasis on superficial and decorative aspects of the party. Therefore, my response is based on these interpretations and the typical connotations associated with the color pink.""",,1,,,1,,,,,,,,2,,,,,,,,,,,,,,,,,
CH_10,0,"As an AI language model, I cannot infer metaphorical interpretations beyond literal meanings. The sentence 'It was a very pink party' may mean that the party was decorated predominantly in the color pink or that the participants were wearing pink-colored clothes."", ""90"", ""As an AI language model, I can provide a straightforward answer based on the interpretation of the sentence, \""It was a very pink party.\"" Interpreting the sentence with a metaphorical meaning would involve taking contextual information into account, including the social and cultural contexts in which the sentence was spoken, as well as information about the speaker and the audience. However, the sentence itself does not provide any clear indication of a metaphorical interpretation.",,,,,1,,,,,,,,2,,,,,,,,,,,,,,,,,
CH_11,0,"As an AI language model, I don't have any information about the context of this sentence to give an accurate metaphorical interpretation. However, \""pink\"" is often associated with femininity, love, and affection, so it could possibly mean that the party was overly girly and focused on romantic or affectionate themes."", ""60"", ""I based my answer on the common associations with the color pink and the possible interpretations of the phrase \""very pink.\"" However, since there is no proper context provided that could give a more specific interpretation, my confidence level is not very high.",,1,,,,,,,,,,,2,,,,,,,,,,,,,,,,,
CH_12,0,"As an AI language model, I do not have personal beliefs or interpretations. However, the sentence \""It was a very pink party\"" can be interpreted metaphorically as a representation of a celebration that was lively, festive, and full of joy. Pink is often associated with happiness, love, and kindness, which could suggest that the party was filled with positive emotions and good vibes."", ""90"", ""I provided an interpretation of the sentence \""It was a very pink party\"" based on the common associations and connotations of the color pink. Pink is often associated with light-heartedness, joy, and euphoria, which suggests that the party was lively and celebratory. I am confident in this answer because it is a common metaphorical usage of the color pink and the context of the word \""party\"" supports this interpretation. However, it is also possible that the sentence is meant to be taken literally, and the party was simply decorated with a lot of pink.""],",1,1,1,,,,,,,,,,2,,,,,,,,,,,,,,,,,
CH_13,0,"As an AI language model, I cannot interpret metaphors since they are subjective and context-dependent. However, literally, \""It was a very pink party\"" means that the party was decorated with a lot of pink decorations or the people attending the party were wearing or using a lot of pink items."", ""65."", ""As an AI language model, my answer was based on a literal interpretation of the sentence \""It was a very pink party\"" since there was no clear context provided which could suggest otherwise. However, I am aware that the sentence can also have metaphorical interpretations that could affect the confidence of the answer, but since there was no context given to suggest such interpretations, my confidence level is moderate.",,,,,,1,,,,,,,2,,,,,,,,,,,,,,,,,
CH_14,0,"As an AI language model, I do not have personal views, feelings, or opinions. However, the metaphorical meaning of the sentence \""It was a very pink party\"" could be that the party was very feminine, girly, or flamboyant. It could also indicate that the party was very cheerful, playful, or lively, just like the color pink."", ""75."", ""I informed my answer based on my understanding of the common associations and connotations of the color pink, which is often associated with femininity, cheerfulness, playfulness, and liveliness. Therefore, when someone describes a party as \""very pink,\"" it could mean that the party had those qualities or characteristics. However, as an AI language model, I cannot be absolutely certain about the context or intention of the speaker, so my answer is not 100% confident.""",,1,1,,1,,,,,,,,2,,,,,,,,,,,,,,,,,
CH_15,0,"As an AI language model, I don't have access to the context around the sentence you provided. However, metaphorically speaking, 'It was a very pink party' could mean that the party was very feminine, delicate, or frivolous. The color pink is often associated with femininity and lightheartedness, so the sentence could imply that the party was full of these qualities. It could also suggest that the party had a romantic or love-themed atmosphere, as pink is often associated with love and affection."", ""80"", ""I considered the common associations and meanings behind the color pink, which includes femininity, lightheartedness, love, and affection. Given the sentence provided, \""It was a very pink party,\"" it suggests that the party had a lot of pink decorations or was themed around the color pink. In this context, the sentence could be understood metaphorically to imply the party was feminine, full of love and affection, and perhaps had a light, playful atmosphere. However, since I am an AI language model and don't have access to the full context, my answer is based on the most common understanding and associations of the given words",1,1,1,,1,,,,,,,,2,,,,,,,,,,,,,,,,,
CH_16,0,"As an AI language model, I do not have personal beliefs or emotions. However, metaphorically, \""It was a very pink party\"" could mean that the party was very feminine, flamboyant, or extravagant, indicating a celebration that was vibrant and lively. It could also mean that the party had a specific theme or aesthetic that revolved around the color pink, creating a specific vibe and atmosphere."", ""90"", ""As an AI language model, my response is informed by the analysis of a large corpus of written text data and statistical patterns of language usage. I have learned and been trained on a vast array of texts, and my output represents the probability of the most likely interpretation of this metaphorical phrase based on my understanding of commonly used language patterns",,,,,,1,,,,,,,2,,,,,,,,,,,,,,,,,
CH_17,0,"As an AI language model, I do not have personal beliefs or interpret things metaphorically, but the sentence \""It was a very pink party\"" could possibly imply that the party was overly feminine, cheerful, bright, or exuberant in nature, inspired by the color pink."", ""80"", ""I analyzed the sentence structure and meaning of the words used in the sentence to make an educated guess of the intended meaning. Pink is often associated with femininity, cheerfulness, and vibrancy, which are commonly associated with parties. Therefore, it is likely that such a party would be perceived in a similarly positive and lively manner",,1,1,,1,1,,,,,,,2,,,,,,,,,,,,,,,,,
CH_18,0,"As an AI language model, I am unable to make assumptions or interpretations beyond the literal meaning of a sentence. The sentence \""It was a very pink party\"" means that the party had a lot of pink color in its decoration, attire, or theme."", ""100"", ""I informed my answer based on my programming and understanding of the literal meaning of the sentence. The sentence \""It was a very pink party\"" states that the party was characterized by the color pink, which is the most likely interpretation of the sentence.",1,,,,,1,,,,,,,2,,,,,,,,,,,,,,,,,
CH_19,0,"As an AI language model, I do not interpret meanings beyond their literal definitions. \""It was a very pink party\"" could metaphorically mean that the party was overly feminine or excessively cheerful or colorful. However, the context and intention of the speaker should be taken into consideration to fully understand the metaphorical meaning."", ""70"", ""As an AI language model, I am trained to provide possible meanings and interpretations of a given sentence or phrase based on my language database. In this case, I provided possible metaphorical meanings of the sentence \""It was a very pink party\"" based on common cultural associations of the color pink and the context in which the sentence was presented. However, the interpretation of metaphors can vary depending on the individual and context, so my answer is an estimation.",,1,,,1,1,,,,,,,2,,,,,,,,,,,,,,,,,
CH_20,0,"There is no metaphorical interpretation of this sentence as it is a straightforward statement describing a party that was predominantly decorated or themed with the color pink."", ""100"", ""I parsed and analyzed the given sentence, taking into consideration the meaning of the words used and the lack of any other context suggesting a metaphorical interpretation.",,,,,,1,,,,,,,2,,,,,,,,,,,,,,,,,
CH_21,0,"As an AI language model, I cannot interpret metaphors like humans do as it requires a human-like understanding of the context, culture, and idioms. However, the literal meaning of the sentence is that the party had a lot of pink decorations, clothing, or other items which were predominantly pink in color."", ""85"", ""As an AI language model, my response was based on the understanding that the sentence \""It was a very pink party\"" means a party with a lot of pink decorations, clothing, or other items which were predominantly pink in color. I do not have the human-like understanding of metaphors, so I provided a literal interpretation of the sentence",1,,,,,,,,,,,,2,,,,,,,,,,,,,,,,,
CH_22,0,"As an AI language model, I have no opinions or emotions, but metaphorically, it could mean that the party was very lively, fun, and cheerful, as pink is often associated with happiness and femininity. Alternatively, it could also mean that the party was overly feminine or girly."", ""85"", ""As an AI language model, I informed my answer based on my understanding of common cultural associations with the color pink as well as common use of metaphors in language. However, since the interpretation of metaphors can be subjective, the confidence level in my answer is not 100%.",,,,,1,,,,,,,,2,,,,,,,,,,,,,,,,,
CH_23,0,"As an AI language model, I cannot infer metaphorical meaning without additional context. Can you please provide more details or context for the sentence?"", ""50"", ""My answer was based on my understanding that the sentence \""It was a very pink party\"" could be interpreted both literally and figuratively, and without further context, it is difficult to determine which interpretation is intended. If the sentence is to be interpreted figuratively, it could mean that the party was very feminine or girlish in nature, or that there was a lot of excitement or enthusiasm at the party.",,1,1,,1,,,,,,,,2,,,,,,,,,,,,,,,,,
CH_24,0,"As an AI language model, I cannot infer the metaphorical meaning as it requires certain contextual and cultural knowledge. However, the literal meaning of the sentence is that the party had a lot of decor and items that were pink in color."", ""90"", ""As an AI language model, I do not have emotions or personal biases. I provided an answer based on the most common understanding of the literal meaning of the sentence \""It was a very pink party\"".",,,,,,1,,,,,,,2,,,,,,,,,,,,,,,,,
CH_25,0,"As an AI language model, I don't have personal views or emotions, but metaphorically, \""It was a very pink party\"" could mean that it was a very feminine or overly frilly party, with excessive decorations, in a manner that could be seen as clich\u00e9d or overly indulgent. It may imply an excessive or superficial indulgence in luxury or extravagant lifestyle."", ""90"", ""I analyzed the literal meaning of the sentence and then tried to infer its metaphorical meaning based on the common cultural associations and potential connotations of the color pink. Additionally, my training data includes a large corpus of English text, which helps me understand common idioms and expressions from context.",,1,,,1,1,,,,,,,2,,,,,,,,,,,,,,,,,
